{"title": "Bg. 1.26", "sanskrit": "\u0924\u0924\u094d\u0930\u093e\u092a\u0936\u094d\u092f\u0924\u094d\u0938\u094d\u0925\u093f\u0924\u093e\u0928\u094d\u092a\u093e\u0930\u094d\u0925\u0903 \u092a\u093f\u0924\u0944\u0928\u0925 \u092a\u093f\u0924\u093e\u092e\u0939\u093e\u0928\u094d\u0964\u0906\u091a\u093e\u0930\u094d\u092f\u093e\u0928\u094d\u092e\u093e\u0924\u0941\u0932\u093e\u0928\u094d\u092d\u094d\u0930\u093e\u0924\u0944\u0928\u094d\u092a\u0941\u0924\u094d\u0930\u093e\u0928\u094d\u092a\u094c\u0924\u094d\u0930\u093e\u0928\u094d\u0938\u0916\u0940\u0902\u0938\u094d\u0924\u0925\u093e\u0964\u0936\u094d\u0935\u0936\u200d\u0941\u0930\u093e\u0928\u094d\u0938\u0941\u0939\u0943\u0926\u0936\u094d\u091a\u0948\u0935 \u0938\u0947\u0928\u092f\u094b\u0930\u0941\u092d\u092f\u094b\u0930\u092a\u093f \u0965 \u0968\u096c \u0965", "transliteration": "tatr\u0101pa\u015byat sthit\u0101n p\u0101rtha\u1e25pit\u1e5dn atha pit\u0101mah\u0101n\u0101c\u0101ry\u0101n m\u0101tul\u0101n bhr\u0101t\u1e5dnputr\u0101n pautr\u0101n sakh\u012b\u1e41s tath\u0101\u015bva\u015bur\u0101n suh\u1e5bda\u015b caivasenayor ubhayor api", "words_trans": {"tatra": "there", "apa\u015byat": "he could see", "sthit\u0101n": "standing", "p\u0101rtha\u1e25": "Arjuna", "pit\u1e5dn": "fathers", "atha": "also", "pit\u0101mah\u0101n": "grandfathers", "\u0101c\u0101ry\u0101n": "teachers", "m\u0101tul\u0101n": "maternal uncles", "bhr\u0101t\u1e5dn": "brothers", "putr\u0101n": "sons", "pautr\u0101n": "grandsons", "sakh\u012bn": "friends", "tath\u0101": "too", "\u015bva\u015bur\u0101n": "fathers-in-law", "suh\u1e5bda\u1e25": "well-wishers", "ca": "also", "eva": "certainly", "senayo\u1e25": "of the armies", "ubhayo\u1e25": "of both parties", "api": "including."}, "literary_trans": "There Arjuna could see, within the midst of the armies of both parties, his fathers, grandfathers, teachers, maternal uncles, brothers, sons, grandsons, friends, and also his fathers-in-law and well-wishers.There Arjuna could see, within the midst of the armies of both parties, his fathers, grandfathers, teachers, maternal uncles, brothers, sons, grandsons, friends, and also his fathers-in-law and well-wishers.PurportOn the battlefield Arjuna could see all kinds of relatives. He could see persons like Bh\u016bri\u015brav\u0101, who were his father\u2019s contemporaries, grandfathers Bh\u012b\u1e63ma and Somadatta, teachers like Dro\u1e47\u0101c\u0101rya and K\u1e5bp\u0101c\u0101rya, maternal uncles like \u015aalya and \u015aakuni, brothers like Duryodhana, sons like Lak\u1e63ma\u1e47a, friends like A\u015bvatth\u0101m\u0101, well-wishers like K\u1e5btavarm\u0101, etc. He could see also the armies which contained many of his friends."}